{
  "protocol_version": "0.1",
  "type": "execution_receipt",
  "id": "rcpt_branch",
  "created_at": "2026-10-13T09:00:03Z",
  "scope": {
    "organization": "harborpine.example",
    "workspace": "internal",
    "project": "brand-approvals"
  },
  "profile": "software-delivery/0.1",
  "contract": {
    "id": "wc_brand_approvals",
    "revision": 1
  },
  "context": {
    "id": "ctx_brand_approvals",
    "revision": 1
  },
  "authority": {
    "id": "auth_coding_agent",
    "revision": 1
  },
  "action": {
    "name": "repo.branch.create",
    "resource": {
      "type": "repository",
      "id": "harborpine/collab-app",
      "scope": {
        "organization": "harborpine.example",
        "workspace": "internal",
        "project": "brand-approvals"
      }
    },
    "requested_at": "2026-10-13T09:00:00Z",
    "idempotency_key": "brand-approvals-branch",
    "payload_digest": "sha256:75ecd2c21ee973a586a27bffacaca3a370620588c633b70b68d17f93bde292df"
  },
  "actor": {
    "principal": {
      "kind": "agent",
      "id": "https://agents.harborpine.example/coding",
      "display": "Coding agent"
    },
    "performed_by": "agent",
    "runtime": {
      "name": "fixture-runtime",
      "version": "0.1.0"
    }
  },
  "decision": {
    "result": "permit",
    "reasons": [],
    "evaluated_at": "2026-10-13T09:00:01Z",
    "policy_ref": "harborpine-agent-work@1"
  },
  "outcome": {
    "status": "succeeded",
    "summary": "Created branch feat/brand-approval-gate from main."
  },
  "started_at": "2026-10-13T09:00:02Z",
  "finished_at": "2026-10-13T09:00:03Z",
  "effects": [
    {
      "description": "Branch feat/brand-approval-gate created.",
      "external_ref": "git:harborpine/collab-app#refs/heads/feat/brand-approval-gate"
    }
  ],
  "artifacts": [
    {
      "id": "art_branch",
      "kind": "branch",
      "ref": "https://git.harborpine.example/collab-app/tree/feat/brand-approval-gate",
      "media_type": "text/plain",
      "digest": "sha1:3f786850e387550fdab836ed7e6dc881de23001b"
    }
  ],
  "trace": {
    "correlation_id": "brand-approvals"
  },
  "integrity": {
    "canonicalization": "rfc8785",
    "attestation": {
      "kind": "none"
    },
    "digest": "sha256:06d91777872676cbd1519356e82a020889dbcc32b68af0823a4572234e8b7d20"
  }
}
